{"adapter_implementation_digest":"sha256:cb11492f75df17b9b24e7c7e7f94ff6a5386060802c16fcf3b4cebfec77c7b98","ae_framework_pin_digest":"sha256:7476eece164e3e82af99537c686e6bf98dcf084ac78d371b8a8a6f310d2e0778","artifact_status":"test-only","execution_mode":"fixture-test","integration_profile_digest":"sha256:ae66efb2ff87feb0a6cb44b7534ee3d330493ca5db8d3f4dfcf78ccbed85cb6a","json_report":{"file_digest":"sha256:2b06c68a5fd9b6b6dac061b2ed34652e8cd95d38cd5f5eb52cfb9c95c3fabf47","path":"private-match-assurance-package.v0.1.json"},"markdown_report":{"file_digest":"sha256:32d1fb5163924437c8cb34138c3b6a5e14077bda672cdb9f9c8e5aa892c537ac","path":"private-match-assurance-package.v0.1.md"},"output_set_digest":"sha256:248cb81bd14d4af15c0dc01430e5b5ccf40a933257ee5a4c3c350bb408f7d948","package_digest":"sha256:5bebfcaed4531980cfa845a41216edbcb81e6a163659a4c8a6cc984d4fd183c1","renderer":{"id":"private-match-assurance/markdown-renderer","implementation_digest":"sha256:be70bb3428b0531481ec16b0240b18227c5f3a40f5171eeb9e93bc440667b132","version":"0.1"},"schema_version":"0.1"}
