{"adapter_implementation_digest":"sha256:accca35e70a5f750d64e2f1935e8aed86838625ecdc237a1394c3787454f522b","ae_framework_pin_digest":"sha256:7476eece164e3e82af99537c686e6bf98dcf084ac78d371b8a8a6f310d2e0778","artifact_status":"test-only","execution_mode":"fixture-test","integration_profile_digest":"sha256:b69172761cc9f164673de3b1ccb58289a145fc88b96d173c5559b175453a6aee","json_report":{"file_digest":"sha256:52bc3fb8c330a5d9dcdf46126a7513db9660f3ba6b8519fb0b293ac6e464c493","path":"private-match-assurance-package.v0.1.json"},"markdown_report":{"file_digest":"sha256:18eed559c07cd74d59bb5cd424786a59e22a6b440c0e001d0eea6f39bf6e2758","path":"private-match-assurance-package.v0.1.md"},"output_set_digest":"sha256:4cc2aa9a7c3872ff7ed2b461cd459bf3a28cd4b2163516c1d9bea8282180a179","package_digest":"sha256:b14dc7bd705ca42c6e6e7e845e6440bbc0024cc5453d78fc7a442b3e73eff290","renderer":{"id":"private-match-assurance/markdown-renderer","implementation_digest":"sha256:ae2a5e64686254cb7551fedaf86cd06cc4d5f5ff32b5dcf03bf59ddb10f5e355","version":"0.1"},"schema_version":"0.1"}
