{"adapter_implementation_digest":"sha256:ff2847244a6cd02efdba6ee430ac287194bd001eba009416df41e3bf5aaa1236","ae_framework_pin_digest":"sha256:7476eece164e3e82af99537c686e6bf98dcf084ac78d371b8a8a6f310d2e0778","artifact_status":"test-only","execution_mode":"fixture-test","integration_profile_digest":"sha256:1ca9838e28a723fad7666aa187aeed77f19ae2b250b4dbc5958ec36e3e1276c5","json_report":{"file_digest":"sha256:e1b85942f898fc4ac48fad1dcafd0c5cb5a5c7b771f29f27257c5f27353f446c","path":"private-match-assurance-package.v0.1.json"},"markdown_report":{"file_digest":"sha256:906e4730e81ac3116e0394450b3ee93a03025d219f4f8aea41bdab532c98a03d","path":"private-match-assurance-package.v0.1.md"},"output_set_digest":"sha256:d1e0952980a275c2c4800b9efbcc9ab9e69cee64370432efe8b75dfb401a98b0","package_digest":"sha256:b68933003cba327f1efac74505318de139acedb10844b95dece122b69cc7f94a","renderer":{"id":"private-match-assurance/markdown-renderer","implementation_digest":"sha256:3c658a396b07cf8705ebae4528ccec759922ea00c9c303cc0dc3d7d99de68a76","version":"0.1"},"schema_version":"0.1"}
