{"adapter_implementation_digest":"sha256:1e6fd85e7f13cc25ab29a8861631b3c5f4df2a5aaf9ff487a25d4eb6d572a5fe","ae_framework_pin_digest":"sha256:7476eece164e3e82af99537c686e6bf98dcf084ac78d371b8a8a6f310d2e0778","artifact_status":"test-only","execution_mode":"fixture-test","integration_profile_digest":"sha256:78f2d3a6ddf9e328a8c14d9d1f9e98a5b60d56466711a838d6257bcd27de059c","json_report":{"file_digest":"sha256:5a62ee88b00e9dcbeab128d78fc35d208a1c45cdbcb519a28283466cdbe6862c","path":"private-match-assurance-package.v0.1.json"},"markdown_report":{"file_digest":"sha256:8d0e6a8386c2717c6b9d581c15382696ac6a42ec9cb39435e25400cd4385588e","path":"private-match-assurance-package.v0.1.md"},"output_set_digest":"sha256:efa26bf3be0337536eb78c9a234aec56f8615a9a8cd1c2131e93c41806fefcf1","package_digest":"sha256:52ac4f6a2ae28efc949260dee65ab8c4a97c1d54cce763e8b812e4d2a719ed0c","renderer":{"id":"private-match-assurance/markdown-renderer","implementation_digest":"sha256:be70bb3428b0531481ec16b0240b18227c5f3a40f5171eeb9e93bc440667b132","version":"0.1"},"schema_version":"0.1"}
